{"name":"myapp_draft","desc":"","tables":[{"name":"labels","type":"BASE TABLE","comment":"","columns":[{"name":"id","type":"bigint(20) unsigned","nullable":false,"default":null,"comment":"","extra_def":"auto_increment"},{"name":"name","type":"varchar(20)","nullable":false,"default":"","comment":""},{"name":"created_at","type":"timestamp","nullable":false,"default":"CURRENT_TIMESTAMP","comment":""}],"indexes":[{"name":"PRIMARY","def":"PRIMARY KEY (id) USING BTREE","table":"labels","columns":["id"],"comment":""},{"name":"name","def":"UNIQUE KEY name (name) USING BTREE","table":"labels","columns":["name"],"comment":""}],"constraints":[{"name":"name","type":"UNIQUE","def":"UNIQUE KEY name (name)","table":"labels","referenced_table":null,"columns":["name"],"referenced_columns":null,"comment":""},{"name":"PRIMARY","type":"PRIMARY KEY","def":"PRIMARY KEY (id)","table":"labels","referenced_table":null,"columns":["id"],"referenced_columns":null,"comment":""}],"triggers":[],"def":"CREATE TABLE `labels` (\n  `id` bigint(20) unsigned NOT NULL AUTO_INCREMENT,\n  `name` varchar(20) COLLATE utf8mb4_unicode_ci NOT NULL DEFAULT '',\n  `created_at` timestamp NOT NULL DEFAULT CURRENT_TIMESTAMP,\n  PRIMARY KEY (`id`),\n  UNIQUE KEY `name` (`name`)\n) ENGINE=InnoDB AUTO_INCREMENT=[Redacted by tbls] DEFAULT CHARSET=utf8mb4 COLLATE=utf8mb4_unicode_ci"},{"name":"site_settings","type":"BASE TABLE","comment":"","columns":[{"name":"id","type":"int(11) unsigned","nullable":false,"default":null,"comment":"","extra_def":"auto_increment"},{"name":"is_maintenance","type":"tinyint(3) unsigned","nullable":true,"default":"0","comment":"0 = off, 1 = on"},{"name":"created_at","type":"timestamp","nullable":false,"default":"CURRENT_TIMESTAMP","comment":""},{"name":"updated_at","type":"timestamp","nullable":false,"default":"CURRENT_TIMESTAMP","extra_def":"on update CURRENT_TIMESTAMP","comment":""}],"indexes":[{"name":"PRIMARY","def":"PRIMARY KEY (id) USING BTREE","table":"site_settings","columns":["id"],"comment":""}],"constraints":[{"name":"PRIMARY","type":"PRIMARY KEY","def":"PRIMARY KEY (id)","table":"site_settings","referenced_table":null,"columns":["id"],"referenced_columns":null,"comment":""}],"triggers":[],"def":"CREATE TABLE `site_settings` (\n  `id` int(11) unsigned NOT NULL AUTO_INCREMENT,\n  `is_maintenance` tinyint(3) unsigned DEFAULT '0' COMMENT '0 = off, 1 = on',\n  `created_at` timestamp NOT NULL DEFAULT CURRENT_TIMESTAMP,\n  `updated_at` timestamp NOT NULL DEFAULT CURRENT_TIMESTAMP ON UPDATE CURRENT_TIMESTAMP,\n  PRIMARY KEY (`id`)\n) ENGINE=InnoDB DEFAULT CHARSET=utf8mb4 COLLATE=utf8mb4_unicode_ci"},{"name":"tasks","type":"BASE TABLE","comment":"","columns":[{"name":"id","type":"bigint(20) unsigned","nullable":false,"default":null,"comment":"","extra_def":"auto_increment"},{"name":"name","type":"varchar(50)","nullable":false,"default":"","comment":""},{"name":"description","type":"varchar(500)","nullable":true,"default":null,"comment":""},{"name":"status","type":"tinyint(3) unsigned","nullable":false,"default":"0","comment":"0 = not yet started, 1 = completed, 2 = in-progress"},{"name":"priority","type":"tinyint(3) unsigned","nullable":false,"default":"0","comment":"0 = low, 1 = med, 2 = high"},{"name":"user_id","type":"bigint(20) unsigned","nullable":false,"default":"0","comment":""},{"name":"due_date_at","type":"timestamp","nullable":true,"default":null,"comment":""},{"name":"created_at","type":"timestamp","nullable":false,"default":"CURRENT_TIMESTAMP","comment":""},{"name":"updated_at","type":"timestamp","nullable":false,"default":"CURRENT_TIMESTAMP","extra_def":"on update CURRENT_TIMESTAMP","comment":""},{"name":"deleted_at","type":"timestamp","nullable":true,"default":null,"comment":""}],"indexes":[{"name":"created_at","def":"KEY created_at (created_at) USING BTREE","table":"tasks","columns":["created_at"],"comment":""},{"name":"description","def":"KEY description (description) USING BTREE","table":"tasks","columns":["description"],"comment":""},{"name":"due_date_at","def":"KEY due_date_at (due_date_at) USING BTREE","table":"tasks","columns":["due_date_at"],"comment":""},{"name":"fk_user_id","def":"KEY fk_user_id (user_id) USING BTREE","table":"tasks","columns":["user_id"],"comment":""},{"name":"name","def":"KEY name (name) USING BTREE","table":"tasks","columns":["name"],"comment":""},{"name":"priority","def":"KEY priority (priority) USING BTREE","table":"tasks","columns":["priority"],"comment":""},{"name":"status","def":"KEY status (status) USING BTREE","table":"tasks","columns":["status"],"comment":""},{"name":"PRIMARY","def":"PRIMARY KEY (id) USING BTREE","table":"tasks","columns":["id"],"comment":""}],"constraints":[{"name":"fk_user_id","type":"FOREIGN KEY","def":"FOREIGN KEY (user_id) REFERENCES users (id)","table":"tasks","referenced_table":"users","columns":["user_id"],"referenced_columns":["id"],"comment":""},{"name":"PRIMARY","type":"PRIMARY KEY","def":"PRIMARY KEY (id)","table":"tasks","referenced_table":null,"columns":["id"],"referenced_columns":null,"comment":""}],"triggers":[],"def":"CREATE TABLE `tasks` (\n  `id` bigint(20) unsigned NOT NULL AUTO_INCREMENT,\n  `name` varchar(50) COLLATE utf8mb4_unicode_ci NOT NULL DEFAULT '',\n  `description` varchar(500) COLLATE utf8mb4_unicode_ci DEFAULT NULL,\n  `status` tinyint(3) unsigned NOT NULL DEFAULT '0' COMMENT '0 = not yet started, 1 = completed, 2 = in-progress',\n  `priority` tinyint(3) unsigned NOT NULL DEFAULT '0' COMMENT '0 = low, 1 = med, 2 = high',\n  `user_id` bigint(20) unsigned NOT NULL DEFAULT '0',\n  `due_date_at` timestamp NULL DEFAULT NULL,\n  `created_at` timestamp NOT NULL DEFAULT CURRENT_TIMESTAMP,\n  `updated_at` timestamp NOT NULL DEFAULT CURRENT_TIMESTAMP ON UPDATE CURRENT_TIMESTAMP,\n  `deleted_at` timestamp NULL DEFAULT NULL,\n  PRIMARY KEY (`id`),\n  KEY `status` (`status`),\n  KEY `priority` (`priority`),\n  KEY `due_date_at` (`due_date_at`),\n  KEY `name` (`name`),\n  KEY `description` (`description`),\n  KEY `fk_user_id` (`user_id`),\n  KEY `created_at` (`created_at`),\n  CONSTRAINT `fk_user_id` FOREIGN KEY (`user_id`) REFERENCES `users` (`id`)\n) ENGINE=InnoDB AUTO_INCREMENT=[Redacted by tbls] DEFAULT CHARSET=utf8mb4 COLLATE=utf8mb4_unicode_ci"},{"name":"tasks_labels","type":"BASE TABLE","comment":"","columns":[{"name":"id","type":"bigint(20) unsigned","nullable":false,"default":null,"comment":"","extra_def":"auto_increment"},{"name":"task_id","type":"bigint(20) unsigned","nullable":false,"default":null,"comment":""},{"name":"label_id","type":"bigint(20) unsigned","nullable":false,"default":null,"comment":""},{"name":"created_at","type":"timestamp","nullable":false,"default":"CURRENT_TIMESTAMP","comment":""}],"indexes":[{"name":"fk_label_id","def":"KEY fk_label_id (label_id) USING BTREE","table":"tasks_labels","columns":["label_id"],"comment":""},{"name":"fk_task_id","def":"KEY fk_task_id (task_id) USING BTREE","table":"tasks_labels","columns":["task_id"],"comment":""},{"name":"PRIMARY","def":"PRIMARY KEY (id) USING BTREE","table":"tasks_labels","columns":["id"],"comment":""}],"constraints":[{"name":"fk_label_id","type":"FOREIGN KEY","def":"FOREIGN KEY (label_id) REFERENCES labels (id)","table":"tasks_labels","referenced_table":"labels","columns":["label_id"],"referenced_columns":["id"],"comment":""},{"name":"fk_task_id","type":"FOREIGN KEY","def":"FOREIGN KEY (task_id) REFERENCES tasks (id)","table":"tasks_labels","referenced_table":"tasks","columns":["task_id"],"referenced_columns":["id"],"comment":""},{"name":"PRIMARY","type":"PRIMARY KEY","def":"PRIMARY KEY (id)","table":"tasks_labels","referenced_table":null,"columns":["id"],"referenced_columns":null,"comment":""}],"triggers":[],"def":"CREATE TABLE `tasks_labels` (\n  `id` bigint(20) unsigned NOT NULL AUTO_INCREMENT,\n  `task_id` bigint(20) unsigned NOT NULL,\n  `label_id` bigint(20) unsigned NOT NULL,\n  `created_at` timestamp NOT NULL DEFAULT CURRENT_TIMESTAMP,\n  PRIMARY KEY (`id`),\n  KEY `fk_task_id` (`task_id`),\n  KEY `fk_label_id` (`label_id`),\n  CONSTRAINT `fk_label_id` FOREIGN KEY (`label_id`) REFERENCES `labels` (`id`),\n  CONSTRAINT `fk_task_id` FOREIGN KEY (`task_id`) REFERENCES `tasks` (`id`)\n) ENGINE=InnoDB AUTO_INCREMENT=[Redacted by tbls] DEFAULT CHARSET=utf8mb4 COLLATE=utf8mb4_unicode_ci"},{"name":"users","type":"BASE TABLE","comment":"","columns":[{"name":"id","type":"bigint(20) unsigned","nullable":false,"default":null,"comment":"","extra_def":"auto_increment"},{"name":"username","type":"varchar(20)","nullable":false,"default":"","comment":""},{"name":"password","type":"varchar(72)","nullable":false,"default":"","comment":""},{"name":"role","type":"tinyint(3) unsigned","nullable":false,"default":"0","comment":"0=normal, 1=admin"},{"name":"last_logged_in_at","type":"timestamp","nullable":true,"default":null,"comment":""},{"name":"created_at","type":"timestamp","nullable":false,"default":"CURRENT_TIMESTAMP","comment":""},{"name":"updated_at","type":"timestamp","nullable":false,"default":"CURRENT_TIMESTAMP","extra_def":"on update CURRENT_TIMESTAMP","comment":""},{"name":"deleted_at","type":"timestamp","nullable":true,"default":null,"comment":""}],"indexes":[{"name":"PRIMARY","def":"PRIMARY KEY (id) USING BTREE","table":"users","columns":["id"],"comment":""},{"name":"username","def":"UNIQUE KEY username (username) USING BTREE","table":"users","columns":["username"],"comment":""}],"constraints":[{"name":"PRIMARY","type":"PRIMARY KEY","def":"PRIMARY KEY (id)","table":"users","referenced_table":null,"columns":["id"],"referenced_columns":null,"comment":""},{"name":"username","type":"UNIQUE","def":"UNIQUE KEY username (username)","table":"users","referenced_table":null,"columns":["username"],"referenced_columns":null,"comment":""}],"triggers":[],"def":"CREATE TABLE `users` (\n  `id` bigint(20) unsigned NOT NULL AUTO_INCREMENT,\n  `username` varchar(20) COLLATE utf8mb4_unicode_ci NOT NULL DEFAULT '',\n  `password` varchar(72) COLLATE utf8mb4_unicode_ci NOT NULL DEFAULT '',\n  `role` tinyint(3) unsigned NOT NULL DEFAULT '0' COMMENT '0=normal, 1=admin',\n  `last_logged_in_at` timestamp NULL DEFAULT NULL,\n  `created_at` timestamp NOT NULL DEFAULT CURRENT_TIMESTAMP,\n  `updated_at` timestamp NOT NULL DEFAULT CURRENT_TIMESTAMP ON UPDATE CURRENT_TIMESTAMP,\n  `deleted_at` timestamp NULL DEFAULT NULL,\n  PRIMARY KEY (`id`),\n  UNIQUE KEY `username` (`username`)\n) ENGINE=InnoDB AUTO_INCREMENT=[Redacted by tbls] DEFAULT CHARSET=utf8mb4 COLLATE=utf8mb4_unicode_ci"}],"relations":[{"table":"tasks","columns":["user_id"],"cardinality":"Zero or more","parent_table":"users","parent_columns":["id"],"parent_cardinality":"Exactly one","def":"FOREIGN KEY (user_id) REFERENCES users (id)","virtual":false},{"table":"tasks_labels","columns":["label_id"],"cardinality":"Zero or more","parent_table":"labels","parent_columns":["id"],"parent_cardinality":"Exactly one","def":"FOREIGN KEY (label_id) REFERENCES labels (id)","virtual":false},{"table":"tasks_labels","columns":["task_id"],"cardinality":"Zero or more","parent_table":"tasks","parent_columns":["id"],"parent_cardinality":"Exactly one","def":"FOREIGN KEY (task_id) REFERENCES tasks (id)","virtual":false}],"functions":[],"driver":{"name":"mysql","database_version":"5.7.44","meta":{"dict":{"Functions":"Stored procedures and functions"}}}}
